### ISSUE TITLE
U64E2 - REST API video, audio, debug stream start and stop commands all 404

### ISSUE THREAD

**Issue by sidchoudhuri** [GideonZ/1541ultimate#530]
REST API stream commands all 404. Is the endpoint broken?
Streaming start and stop work fine when initiated from the U64E2.
The U64E2 is at 192.168.2.64 (ethernet)
My computer is at 192.168.2.200
Video
```
No.	Time	Source	Destination	Protocol	Length	Info
85191	1252.400873	192.168.2.200	192.168.2.64	HTTP	172	PUT /v1/streams/video:start?=192.168.2.200:11000 HTTP/1.1 
85192	1252.420267	192.168.2.64	192.168.2.200	TCP	99	80 → 59389 [PSH, ACK] Seq=1 Ack=119 Win=7182 Len=45 [TCP PDU reassembled in 85193]
85193	1252.420270	192.168.2.64	192.168.2.200	HTTP	60	HTTP/1.1 404 Not Found 

```
Audio
```
No.	Time	Source	Destination	Protocol	Length	Info
78857	1162.085283	192.168.2.200	192.168.2.64	HTTP	172	PUT /v1/streams/audio:start?=192.168.2.200:11001 HTTP/1.1 
78860	1162.104062	192.168.2.64	192.168.2.200	TCP	99	80 → 59352 [PSH, ACK] Seq=1 Ack=119 Win=7182 Len=45 [TCP PDU reassembled in 78861]
78861	1162.104064	192.168.2.64	192.168.2.200	HTTP	60	HTTP/1.1 404 Not Found 

```
Debug
```
No.	Time	Source	Destination	Protocol	Length	Info
74007	1067.186312	192.168.2.200	192.168.2.64	HTTP	172	PUT /v1/streams/debug:start?=192.168.2.200:11002 HTTP/1.1 
74008	1067.203210	192.168.2.64	192.168.2.200	TCP	99	80 → 59330 [PSH, ACK] Seq=1 Ack=119 Win=7182 Len=45 [TCP PDU reassembled in 74009]
74009	1067.203211	192.168.2.64	192.168.2.200	HTTP	60	HTTP/1.1 404 Not Found 
```
PUT calls like reboot work
```
No.	Time	Source	Destination	Protocol	Length	Info
90900	1362.701565	192.168.2.200	192.168.2.64	HTTP	146	PUT /v1/machine:reboot HTTP/1.1 
90901	1362.743588	192.168.2.64	192.168.2.200	TCP	60	80 → 59401 [ACK] Seq=1 Ack=93 Win=7208 Len=0
90904	1362.839512	192.168.2.64	192.168.2.200	TCP	144	80 → 59401 [PSH, ACK] Seq=1 Ack=93 Win=7208 Len=90 [TCP PDU reassembled in 90905]
90905	1362.839514	192.168.2.64	192.168.2.200	HTTP/JSON	76	HTTP/1.1 200 OK , JSON (application/json)
```
GET calls work fine, eg ethernet*, data streams*
```
56455	980.050004	192.168.2.200	192.168.2.64	HTTP	531	GET /v1/configs/ethernet* HTTP/1.1 
56456	980.055074	192.168.2.64	192.168.2.200	TCP	60	80 → 56365 [SYN, ACK] Seq=0 Ack=1 Win=7300 Len=0 MSS=1460
56457	980.055218	192.168.2.200	192.168.2.64	TCP	54	56365 → 80 [ACK] Seq=1 Ack=1 Win=65535 Len=0
56458	980.061200	192.168.2.200	192.168.2.64	TCP	54	56365 → 80 [FIN, ACK] Seq=1 Ack=1 Win=65535 Len=0
56460	980.062482	192.168.2.64	192.168.2.200	TCP	145	80 → 56363 [PSH, ACK] Seq=1 Ack=478 Win=6823 Len=91 [TCP PDU reassembled in 56461]
56461	980.062483	192.168.2.64	192.168.2.200	HTTP/JSON	265	HTTP/1.1 200 OK , JSON (application/json)
```
```
85913	1507.418531	192.168.2.200	192.168.2.64	HTTP	537	GET /v1/configs/data%20streams* HTTP/1.1 
85937	1507.429968	192.168.2.64	192.168.2.200	TCP	145	80 → 56466 [PSH, ACK] Seq=1 Ack=484 Win=6817 Len=91 [TCP PDU reassembled in 85938]
85938	1507.429970	192.168.2.64	192.168.2.200	HTTP/JSON	270	HTTP/1.1 200 OK , JSON (application/json)
```
My U64E2 ethernet settings:
```json
{ 
  "Ethernet Settings" : { 
  "Use DHCP" : "Enabled",
  "Static IP" : "192.168.2.64",
  "Static Netmask" : "255.255.255.0",
  "Static Gateway" : "192.168.2.1",
  "Static DNS" : "8.8.8.8"
},
  "errors" : [  ]
}
```
My U64E2 Streaming settings
```json
{ 
  "Data Streams" : { 
  "Stream VIC to" : "192.168.2.200:11000",
  "Stream Audio to" : "192.168.2.200:11001",
  "Stream Debug to" : "192.168.2.200:11002",
  "Debug Stream Mode" : "6510 Only"
},
  "errors" : [  ]
}
```

**Comment by chrisgleissner** [comment]
The REST stream endpoints are available and working in current firmware.

The start command requires the named `ip` parameter, e.g.:

`PUT /v1/streams/video:start?ip=192.168.2.200:11000`

The examples above use `?=...` instead.

A later issue affecting remote stream control was also identified in #613 and fixed in 6e526f0, with the fix subsequently confirmed on U64E2 hardware.

Closing this issue as completed.
